{
  "device_time_semantics": null,
  "metric_semantics": {
    "ema_dev_metric": {
      "direction": "minimize",
      "metric": "development MAE",
      "role_identity": "fixed-pcqm4mv2-ogb-train-100k-internal-development-50k",
      "target": "B3LYP/6-31G* gap",
      "unit": "eV",
      "weights": "ema"
    },
    "live_dev_metric": {
      "direction": "minimize",
      "metric": "development MAE",
      "role_identity": "fixed-pcqm4mv2-ogb-train-100k-internal-development-50k",
      "target": "B3LYP/6-31G* gap",
      "unit": "eV",
      "weights": "live"
    },
    "live_train_metric": {
      "direction": "minimize",
      "metric": "online batch-weighted MAE",
      "role_identity": "fixed-pcqm4mv2-ogb-train-100k",
      "target": "B3LYP/6-31G* gap",
      "unit": "eV",
      "weights": "live"
    }
  },
  "observations": [
    {
      "checkpoint_identity": "sha256:82552c3091ff4d16a2a410775a6dc6df8f73b6cef5b89a4e52ec28e48cbad6c2",
      "cumulative_device_time_seconds": null,
      "cumulative_wall_time_seconds": 194.91873460399995,
      "device_time_seconds": null,
      "ema_dev_metric": 0.46451351046562195,
      "epoch_or_pass": 1,
      "event": "checkpoint",
      "learning_rate": 0.00025,
      "live_dev_metric": 0.3322547674179077,
      "live_train_metric": 0.4372963937290081,
      "optimizer_step": 781,
      "sample_presentations": 99968,
      "sequence": 0,
      "wall_time_seconds": 194.91873460399995
    },
    {
      "checkpoint_identity": "sha256:4bb80ca080eed9829c847e9df8fe1ab4b99255ac4c87153be16f9b6c4e4c59b5",
      "cumulative_device_time_seconds": null,
      "cumulative_wall_time_seconds": 382.02903893999996,
      "device_time_seconds": null,
      "ema_dev_metric": 0.3453516364097595,
      "epoch_or_pass": 2,
      "event": "checkpoint",
      "learning_rate": 0.0005,
      "live_dev_metric": 0.30035895109176636,
      "live_train_metric": 0.3208949360197163,
      "optimizer_step": 1562,
      "sample_presentations": 199936,
      "sequence": 1,
      "wall_time_seconds": 187.110304336
    },
    {
      "checkpoint_identity": "sha256:a3894eb2757b49a4e7fa0613bf341455192fe2e51387b7e194b6598db891b029",
      "cumulative_device_time_seconds": null,
      "cumulative_wall_time_seconds": 568.298711305,
      "device_time_seconds": null,
      "ema_dev_metric": 0.3020783066749573,
      "epoch_or_pass": 3,
      "event": "checkpoint",
      "learning_rate": 0.00075,
      "live_dev_metric": 0.27674242854118347,
      "live_train_metric": 0.2777515525656119,
      "optimizer_step": 2343,
      "sample_presentations": 299904,
      "sequence": 2,
      "wall_time_seconds": 186.26967236500002
    },
    {
      "checkpoint_identity": "sha256:f07a8347e16a49a64b9e5b35c7e117ec07bdaa5ff4449b23e5790d410a67a216",
      "cumulative_device_time_seconds": null,
      "cumulative_wall_time_seconds": 756.98617062,
      "device_time_seconds": null,
      "ema_dev_metric": 0.2665293216705322,
      "epoch_or_pass": 4,
      "event": "checkpoint",
      "learning_rate": 0.001,
      "live_dev_metric": 0.303920716047287,
      "live_train_metric": 0.2644744615882662,
      "optimizer_step": 3124,
      "sample_presentations": 399872,
      "sequence": 3,
      "wall_time_seconds": 188.68745931500007
    },
    {
      "checkpoint_identity": "sha256:369c97cd7ceff51074248ce46b036f8a4ce5e003eaa4f4349b0e1aacf28b0ad7",
      "cumulative_device_time_seconds": null,
      "cumulative_wall_time_seconds": 945.9309460350001,
      "device_time_seconds": null,
      "ema_dev_metric": 0.24129198491573334,
      "epoch_or_pass": 5,
      "event": "checkpoint",
      "learning_rate": 0.001,
      "live_dev_metric": 0.25017741322517395,
      "live_train_metric": 0.24277387477245133,
      "optimizer_step": 3905,
      "sample_presentations": 499840,
      "sequence": 4,
      "wall_time_seconds": 188.9447754150001
    },
    {
      "checkpoint_identity": "sha256:e98b656bf819524dc27725264ee6af3e482dc6150652977e087b99fac9779966",
      "cumulative_device_time_seconds": null,
      "cumulative_wall_time_seconds": 1133.292401094,
      "device_time_seconds": null,
      "ema_dev_metric": 0.22321882843971252,
      "epoch_or_pass": 6,
      "event": "checkpoint",
      "learning_rate": 0.0009991853674111047,
      "live_dev_metric": 0.23924964666366577,
      "live_train_metric": 0.22943761761114523,
      "optimizer_step": 4686,
      "sample_presentations": 599808,
      "sequence": 5,
      "wall_time_seconds": 187.36145505900004
    },
    {
      "checkpoint_identity": "sha256:6543f96ef47cff003a7d38d49b10938e678ad10bc2e1c59c9172e3ded4f5f3f9",
      "cumulative_device_time_seconds": null,
      "cumulative_wall_time_seconds": 1322.467613968,
      "device_time_seconds": null,
      "ema_dev_metric": 0.21073995530605316,
      "epoch_or_pass": 7,
      "event": "checkpoint",
      "learning_rate": 0.0009967441268066007,
      "live_dev_metric": 0.21539101004600525,
      "live_train_metric": 0.2185607305605524,
      "optimizer_step": 5467,
      "sample_presentations": 699776,
      "sequence": 6,
      "wall_time_seconds": 189.17521287399995
    },
    {
      "checkpoint_identity": "sha256:05b21b3177c16da56232f331a4f7678469cac2b50306f4a758a6de9a75804ad5",
      "cumulative_device_time_seconds": null,
      "cumulative_wall_time_seconds": 1513.268140212,
      "device_time_seconds": null,
      "ema_dev_metric": 0.20184069871902466,
      "epoch_or_pass": 8,
      "event": "checkpoint",
      "learning_rate": 0.0009926842410059227,
      "live_dev_metric": 0.2205515205860138,
      "live_train_metric": 0.20744974471809582,
      "optimizer_step": 6248,
      "sample_presentations": 799744,
      "sequence": 7,
      "wall_time_seconds": 190.8005262439999
    },
    {
      "checkpoint_identity": "sha256:105976a2a1be29316671cc1886f6376c8e0fce61479da885214907edfc28729c",
      "cumulative_device_time_seconds": null,
      "cumulative_wall_time_seconds": 1701.5697203339998,
      "device_time_seconds": null,
      "ema_dev_metric": 0.19397787749767303,
      "epoch_or_pass": 9,
      "event": "checkpoint",
      "learning_rate": 0.0009870189525126956,
      "live_dev_metric": 0.20701460540294647,
      "live_train_metric": 0.2022165144308517,
      "optimizer_step": 7029,
      "sample_presentations": 899712,
      "sequence": 8,
      "wall_time_seconds": 188.3015801219999
    },
    {
      "checkpoint_identity": "sha256:eb2147d01dcef6dbf5e8907693063958e53f26d5c43b78c6b8990087be1e089e",
      "cumulative_device_time_seconds": null,
      "cumulative_wall_time_seconds": 1889.318972289,
      "device_time_seconds": null,
      "ema_dev_metric": 0.18770137429237366,
      "epoch_or_pass": 10,
      "event": "checkpoint",
      "learning_rate": 0.0009797667403204414,
      "live_dev_metric": 0.20547287166118622,
      "live_train_metric": 0.19246268874409939,
      "optimizer_step": 7810,
      "sample_presentations": 999680,
      "sequence": 9,
      "wall_time_seconds": 187.7492519550001
    },
    {
      "checkpoint_identity": "sha256:db5853bd3980f3270b6ab892cbb4a0d70a81b33bd8fd2fd524dd72e90cc82316",
      "cumulative_device_time_seconds": null,
      "cumulative_wall_time_seconds": 2077.9529946859993,
      "device_time_seconds": null,
      "ema_dev_metric": 0.18263757228851318,
      "epoch_or_pass": 11,
      "event": "checkpoint",
      "learning_rate": 0.0009709512596379428,
      "live_dev_metric": 0.19820521771907806,
      "live_train_metric": 0.1879065064419438,
      "optimizer_step": 8591,
      "sample_presentations": 1099648,
      "sequence": 10,
      "wall_time_seconds": 188.63402239699963
    },
    {
      "checkpoint_identity": "sha256:87bace15cad78ac988f8ebc432b8db9cafbc49909e8a8ffc87578df849f71e2d",
      "cumulative_device_time_seconds": null,
      "cumulative_wall_time_seconds": 2266.5325049339995,
      "device_time_seconds": null,
      "ema_dev_metric": 0.1780390590429306,
      "epoch_or_pass": 12,
      "event": "checkpoint",
      "learning_rate": 0.0009606012647308677,
      "live_dev_metric": 0.1888010948896408,
      "live_train_metric": 0.18290269147600152,
      "optimizer_step": 9372,
      "sample_presentations": 1199616,
      "sequence": 11,
      "wall_time_seconds": 188.57951024800013
    },
    {
      "checkpoint_identity": "sha256:59107dd768ac440cdc04b003c388e8c82cfc2061cf8ba66d76ad97ea9ef74435",
      "cumulative_device_time_seconds": null,
      "cumulative_wall_time_seconds": 2453.3008026479993,
      "device_time_seconds": null,
      "ema_dev_metric": 0.17551735043525696,
      "epoch_or_pass": 13,
      "event": "checkpoint",
      "learning_rate": 0.0009487505151313336,
      "live_dev_metric": 0.19511453807353973,
      "live_train_metric": 0.17688610091312099,
      "optimizer_step": 10153,
      "sample_presentations": 1299584,
      "sequence": 12,
      "wall_time_seconds": 186.7682977139998
    },
    {
      "checkpoint_identity": "sha256:60d06da7b8a2955e537e2d1c0176e0f2b28b8db74ec200bc35198dec8921bf10",
      "cumulative_device_time_seconds": null,
      "cumulative_wall_time_seconds": 2643.8381000459995,
      "device_time_seconds": null,
      "ema_dev_metric": 0.17204353213310242,
      "epoch_or_pass": 14,
      "event": "checkpoint",
      "learning_rate": 0.0009354376655213288,
      "live_dev_metric": 0.19988901913166046,
      "live_train_metric": 0.1735641999446129,
      "optimizer_step": 10934,
      "sample_presentations": 1399552,
      "sequence": 13,
      "wall_time_seconds": 190.5372973980002
    },
    {
      "checkpoint_identity": "sha256:ec7ce2e11deaa5b4c9764bd81dccc1b9303c7b5daa2607656e60e33f643bc02e",
      "cumulative_device_time_seconds": null,
      "cumulative_wall_time_seconds": 2831.1908443479997,
      "device_time_seconds": null,
      "ema_dev_metric": 0.16962864995002747,
      "epoch_or_pass": 15,
      "event": "checkpoint",
      "learning_rate": 0.0009207061396491751,